date,text
2022-01-18,В МИД заявили об угрозах в адрес российских дипломатов на Украине 
2022-01-18,Большинство сотрудников вузов Москвы и Петербурга привились от COVID-19 
2022-01-18,Газпром нефть заправила первый грузовой самолет зеленым авиатопливом 
2022-01-18,The Rasmus записали песню для Евровидения-2022 
2022-01-18,Это не твоя компания: Загитова появилась на одной вечеринке с Милохиным 
2022-01-18,"В ФРГ рассказали, зачем ЕС варианты реагирования по ""Северному потоку — 2"" "
2022-01-18,"Симптомы “омикрона”: отличия от других штаммов, как защититься "
2022-01-18,В Марий Эл выявили первые три случая заражения омикрон-штаммом 
2022-01-18,"Гендиректора компании ""Казань"" заподозрили в уклонении от уплаты налогов "
2022-01-18,Нижегородец сбросил жену с четвертого этажа 
2022-01-18,Суд рассмотрит жалобу Meta на двухмиллиардный штраф 
2022-01-18,В США заключенные обвинили тюрьму в медицинских экспериментах над ними 
2022-01-18,"В Приморье завели дело на мужчину, протащившего на автомобиле полицейского "
2022-01-18,"Лавров и Бербок обсудят темы, ""бросающие тень"" на отношения России и ФРГ "
2022-01-18,"НАТО стремится оккупировать Украину, заявил Володин "
2022-01-18,В Госдуме призвали Вашингтон пересмотреть доктрину внешней политики 
2022-01-18,"Эксперты рассказали, как туристы попадают в закрытые европейские страны "
2022-01-18,"ФАС согласовала цену на российское противоопухолевое лекарство ""Кабатэкс"" "
2022-01-18,Володин заявил о выполнении 80% поручений из послания президента 
2022-01-18,Более 90 тысяч рабочих и 12 тысяч машин убирают Москву после снегопада 
2022-01-18,Монеточка решила продать квартиру из-за обнародованного адреса 
2022-01-18,МИД Украины опроверг сообщения NYT об эвакуации российских дипломатов 
2022-01-18,Генсек ОДКБ выступит в Госдуме 
2022-01-18,Два дивизиона С-400 перебросят в Белоруссию для проверки сил реагирования 
2022-01-18,ЕС и Россия продолжают переговоры по взаимному признанию COVID-сертификатов 
2022-01-18,Иеромонах-реаниматолог Феодорит: на Крещение есть нечто важнее купаний 
2022-01-18,В Ассоциации кондитеров прокомментировали сообщения о подорожании продукции 
2022-01-18,"Против жительницы Нижегородской области, избивавшей сына, возбудили дело "
2022-01-18,Сугробы в Москве за сутки выросли на четверть 
2022-01-18,Москва и Минск готовы использовать весь военный потенциал ради безопасности 
2022-01-18,Россияне раскупили дешевые туры в Таиланд 
2022-01-18,Оперштаб назвал регионы с наименьшими темпами прироста COVID-19 за сутки 
2022-01-18,В России выявили 31 252 новых случая COVID-19 
2022-01-18,Иеромонах предупредил об опасности погружения в прорубь в пьяном виде 
2022-01-18,TikTok ввел форму обратной связи 
2022-01-18,"В Орловской области выздоровели студенты, у которых ранее выявили ""омикрон"" "
2022-01-18,В Минске анонсировали проверку сил реагирования Союзного государства 
2022-01-18,Дочь Пригожина объявила о свадьбе 
2022-01-18,Правящая партия Казахстана начала готовиться к внеочередному съезду 
2022-01-18,Заполняемость отелей Верхневолжья в новогодние праздники достигла почти 90% 
2022-01-18,Хуситы заявили о запуске баллистической ракеты по аэропорту в Дубае 
2022-01-18,Российские ученые создали искусственные антитела для профилактики COVID-19 
2022-01-18,РЖД в 2021 году увеличили перевозку тихоокеанских морепродуктов из Приморья 
2022-01-18,Нарышкин сравнил ситуацию на Украине с гитлеровским террором 
2022-01-18,Нарышкин раскритиковал действия украинских властей против Порошенко 
2022-01-18,"Гендиректором ""Пятерочки"" назначили Владислава Курбатова "
2022-01-18,"В Омской области зафиксировали первые случаи заражения ""омикроном"" "
2022-01-18,"Гинцбург оценил эффективность ""Спутника V"" против ""омикрона"" в 75 процентов "
2022-01-18,Пропавшие на снегоходе в Мурманской области отец с сыном вышли на связь 
2022-01-18,В Смоленске двухлетняя девочка сама ушла из детского сада 
2022-01-18,ФСБ рассказала об использовании против гитлеровцев опыта войны 1812 года 
2022-01-18,Собянин поздравил с юбилеем народную артистку России Тамару Гвердцители 
2022-01-18,Режиссера Аллу Сурикову выписывают из больницы 
2022-01-18,Цена нефти WTI впервые с 25 октября поднялась выше 85 долларов 
2022-01-18,"Московские аэропорты работают штатно, несмотря на снегопад "
2022-01-18,"Рассекречен смартфон Samsung Galaxy A53, который получит 5G "
2022-01-18,"Суд возобновил рассмотрение дела рыбаков из КНДР, напавших на пограничников "
2022-01-18,Врач назвала вакцинацию профилактикой развития бесплодия из-за COVID-19 
2022-01-18,"На синей ветке метро Москвы остановлено движение от ""Киевской"" до ""Курской"" "
2022-01-18,"Москва заинтересована в добрососедских отношениях с Киевом, заявил Нарышкин "
2022-01-18,В Петербурге мошенники обманули бизнесмена с Урала на 11 миллионов рублей 
2022-01-18,В Новгородской области четыре человека погибли в ДТП с грузовиком 
2022-01-18,Глава Алтайского края ревакцинировался от COVID-19 
2022-01-18,В МИД опровергли информацию об эвакуации российских дипломатов из Украины 
2022-01-18,Британцы высмеяли украинских военных за деревянные автоматы 
2022-01-18,В СПЧ предложили известным режиссерам обратиться к теме блокады Ленинграда 
2022-01-18,После беспорядков в Казахстане завели 695 уголовных дел 
2022-01-18,"В Заполярье отец с семилетним сыном пропали, катаясь на снегоходе "
2022-01-18,"Гидрометцентр продлил ""желтый"" уровень погодной опасности в Москве "
2022-01-18,"Вирусолог назвал сроки спада заболеваемости ""омикроном"" в России "
2022-01-18,"СМИ узнали о предложениях главы ""Роснефти"" по реформе энергорынка "
2022-01-18,Минэкономразвития оценило итоги реализации ФЦП в Крыму и Севастополе 
2022-01-18,В Магнитогорске задержали предполагаемого убийцу водителя 
2022-01-18,Педиатр рассказал об исследованиях вакцины от COVID-19 для подростков 
2022-01-18,"Оператору проекта ""Сахалин-1"" предложили инвестировать в Хабаровский край "
2022-01-18,Минсельхоз прокомментировал сообщения о подорожании кондитерских изделий 
2022-01-18,Германские элиты готовятся принести свою страну в жертву атлантистам 
2022-01-18,Ошибочное мнение. Почему Церковь не велит купаться на Крещение 
2022-01-18,Росатом предложил закрепить за ним выдачу разрешений на проход по СМП 
2022-01-18,Сорок самолетов с миротворцами ОДКБ прибыли из Казахстана в Россию за сутки 
2022-01-18,Кабмин Казахстана одобрил план по стабилизации ситуации после беспорядков 
2022-01-18,В Казахстане зафиксировали резкий всплеск заболеваемости коронавирусом 
2022-01-18,"Врач-инфекционист рассказал, кому стоит воздержаться от крещенских купаний "
2022-01-18,Последний богатырь 3 собрал в прокате более двух миллиардов  
2022-01-18,В Алма-Ате назвали число задержанных участников незаконных акций 
2022-01-18,В Приморье пьяный водитель протащил полицейского и врезался в стену 
2022-01-18,"Опрос показал, что стабильность компании наиболее значима для соискателей "
2022-01-18,"Рэпер 50 Cent представил клип на трек ""Power Powder Respect"" "
2022-01-18,"Посол Украины решил научить немцев считаться с ""великой европейской нацией"" "
2022-01-18,"Гинцбург заявил о разработке теста на нейтрализующие ""омикрон"" антитела "
2022-01-18,"Биолог спрогнозировал резкий рост заболеваемости ""омикроном"" в России "
2022-01-18,Синоптик рассказал о погоде в Приморье в Крещенскую ночь 
2022-01-18,Обычный день в России: американцев восхитило видео с микроавтобусом 
2022-01-18,Экс-министр энергетики Украины допустила воровство российского газа 
2022-01-18,"Специалист подсчитала, в какие месяцы выгоднее всего идти в отпуск "
2022-01-18,"Секретарь СНБО заявил, что Украине нужно больше оружия "
2022-01-18,"Пушков предупредил Францию о последствиях ""сдерживания"" России "
2022-01-18,"СМИ: шведских детей запугали разговорами о ""российском вторжении"" "
2022-01-18,AFP: Мали попросила Францию пересмотреть оборонные соглашения 
2022-01-18,Киану Ривз назвал любимые песню и фильм 
2022-01-18,"КНДР заявила, что провела испытания тактических управляемых ракет "
2022-01-18,Арабская коалиция объявила о начале бомбардировок столицы Йемена 
2022-01-18,В России стартовал пятый этап туристического кешбэка 
2022-01-18,В России начинаются крещенские купания 
2022-01-17,"Арестович уволился из офиса президента Украины, сообщили СМИ "
2022-01-17,Суд по избранию меры пресечения Порошенко перенесли на 19 января 
2022-01-17,"Боррель исключил ""превентивные санкции"" ЕС против России из-за Украины "
2022-01-17,ИКАО разослала отчет о расследовании инцидента с самолетом Ryanair в Минске 
2022-01-17,Боррель не считает пересмотр архитектуры безопасности безумной идеей 
2022-01-17,"В Дагестане зарегистрировали первый случай ""омикрона"" "
2022-01-17,"Зеленский и глава МИД ФРГ надеются на скорую встречу ""нормандского формата"" "
2022-01-17,Суд подсчитал годовой доход Google и Meta в России 
2022-01-17,"В Киеве закрыли еще одну станцию метро из-за сообщения о ""минировании"" "
2022-01-17,Белый дом не исключил возможности отключения России от SWIFT 
2022-01-17,"Британия поставит Украине противотанковые вооружения для ""самообороны"" "
2022-01-17,Порошенко исчез из списка внутригосударственного розыска Украины 
2022-01-17,"Западу не выгодны проблемы в банковской системе России, заявил сенатор "
2022-01-17,Минздрав утвердил перечень противопоказаний к вакцинации от COVID-19 
2022-01-17,Цена на газ в Европе снизилась до 900 долларов за тысячу кубов 
2022-01-17,"Кувейт становится непригодным для жизни, сообщил Bloomberg "
2022-01-17,"В Финляндии изобрели тестер, определяющий коронавирус за секунды "
2022-01-17,Захарова оценила запрос Германии к Нидерландам об увеличении поставок газа 
2022-01-17,"Силовики ВСУ обстреляли из гранатомета село в Донбассе, заявили в ДНР "
2022-01-17,"МИД обвинил НАТО в ""остром положении"" в Балтийском регионе и на Черном море "
2022-01-17,В Госдуме поддержали поправки к проекту о пожизненном сроке для педофилов 
2022-01-17,"МИД отверг заявления, что Россия пытается восстановить зоны влияния в мире "
2022-01-17,Генсек ООН призвал мир готовиться к следующей пандемии 
2022-01-17,"Извержение вулкана в Тонга стало мощнейшим с 1100 года, предположили ученые "
2022-01-17,Крупнейшие стройки Ленобласти стали частью дорожного нацпроекта 
2022-01-17,Из Сочи в Израиль можно будет добраться на круизном лайнере 
2022-01-17,Школьники МО смогут заниматься в библиотеках в VR-очках 
2022-01-17,Новое граффити появилось рядом с работой Бэнкси в британском Бристоле 
2022-01-17,Газовые операторы Польши и Украины начали совместные консультации 
2022-01-17,Землю засыпает вулканическим пеплом. Чем грозит извержение у берегов Тонга 
2022-01-17,В Петербурге допустили новые меры при всплеске заболеваемости COVID-19 
2022-01-17,Viber сообщил об открытии представительства в России 
2022-01-17,Суд ушел в совещательную комнату для избрания Порошенко меры пресечения 
2022-01-17,На границе Китая и Монголии произошло землетрясение 
2022-01-17,Японцы остались в восторге от советского самолета 
2022-01-17,В Киеве призвали НАТО к конкретным шагам по включению Украины в альянс 
2022-01-17,Чем интересен недорогой смартфон Poco M4 Pro 5G и почему он не Xiaomi 
2022-01-17,Рябков и посол Индии обсудили итоги встреч России с США и НАТО 
2022-01-17,В Севастополе зафиксировали значительный рост числа заболевших COVID-19 
2022-01-17,"Иностранные СМИ готовятся обвинить ЛНР в обстрелах, заявили в Луганске "
2022-01-17,Минздрав Подмосковья призвал не купаться на Крещение после прививки 
2022-01-17,Соцпроекты Ленобласти получат гранты Президентского фонда 
2022-01-17,"Суд отклонил кассационную жалобу на приговор по делу ""Нового величия"" "
2022-01-17,В Израиле предложили учредить День памяти исхода евреев из СССР 
2022-01-17,Совет Госдумы поддержал снятие с рассмотрения законопроекта о QR-кодах 
2022-01-17,Расследование дела казахского банкира Аблязова закрыли летом 2021 года 
2022-01-17,В Подмосковье запустили производство тестов на выявление омикрон-штамма 
2022-01-17,"В Коми выявили первые 23 случая заражения ""омикроном"" "
2022-01-17,Житель Мордовии получил 14 лет колонии за насилие над двумя девочками 
2022-01-17,"Полиция проверит инцидент в Ярославле, где автомобилист не пропускал скорую "
2022-01-17,В Москве начинается II Международный музыкальный фестиваль Валерия Халилова 
2022-01-17,Главу таможенной службы Киргизии задержали за коррупцию 
2022-01-17,Порошенко назвал Зеленского неадекватным человеком 
2022-01-17,"Глава Ирана выступит на заседании Госдумы, сообщил Жуков "
2022-01-17,Житель Липецка получил срок за откушенный знакомому палец 
2022-01-17,В Ставропольском крае в ДТП погиб один человек  
2022-01-17,"В ДНР заявили о прибытии в Донбасс бойцов ""Правого сектора""* "
2022-01-17,Турчак призвал подумать о субсидиях местным властям для подготовки служащих 
2022-01-17,Польской армии поставили некачественную обувь 
2022-01-17,Booking объяснила ужесточение политики в Крыму санкциями Евросоюза 
2022-01-17,"Порошенко пытался устроить скандал в аэропорту, заявили в Раде "
2022-01-17,Слуга народа призвала Порошенко не скандализировать уголовное дело 
2022-01-17,В Польше мужчина с мачете ранил четырех прохожих 
2022-01-17,Порошенко заснул в суде на заседании по избранию ему меры пресечения 
2022-01-17,Госспецсвязь Украины сообщила о новой атаке хакеров на сайт 
2022-01-17,Глава МИД Германии заявила о неизменной политике по экспорту вооружений 
2022-01-17,"В РПЦ предостерегли от ""алкогольной вакханалии"" на Крещение "
2022-01-17,Европе посоветовали поменять стратегию хранения газа 
2022-01-17,Названы характеристики китайского суперфлагманского смартфона 
2022-01-17,Кулеба обвинил Россию в блокировке процесса урегулирования в Донбассе 
2022-01-17,Российский постпред раскритиковал реакцию ОБСЕ на ситуацию в Казахстане 
2022-01-17,Путин продлил срок службы спецпредставителю по экологии Иванову 
2022-01-17,Замсекретаря ОП остается в реанимации 
2022-01-17,"В России могут создать комиссию по поддержке одаренных детей, заявили в СПЧ "
2022-01-17,В СПЧ анонсировали план действий по дальнейшему обучению Тепляковой 
2022-01-17,В Киеве опровергли заявление Лукашенко об украинских радикалах на границе 
2022-01-17,В Москве оборудуют места для крещенских купаний  
2022-01-17,Кандидата в президенты Франции оштрафовали за разжигание расовой ненависти 
2022-01-17,Две девочки погибли при пожаре в Екатеринбурге 
2022-01-17,"Власти Петербурга опасаются ""вертикального подъема заболеваемости"" COVID-19 "
2022-01-17,"Суд лишил прав родителей девочки, жившей в московском медцентре "
2022-01-17,"В Туле проверяют инцидент с трамваем, окатившим прохожих грязным снегом "
2022-01-17,НАТО опубликовала стратегию по космосу 
2022-01-17,Путин поручил ускорить развитие туристской инфраструктуры 
2022-01-17,Путин поручил подготовить идеи по развитию дорожной сети 
2022-01-17,Суд в Киеве продолжил заседание об избрании Порошенко меры пресечения 
2022-01-17,В МИД выразили разочарование противодействием RT DE в Берлине 
2022-01-17,"Европа отобрала из подземных хранилищ 62,6% закачанного летом газа "
2022-01-17,Рогов рассказал об уходе с СТС 
2022-01-17,В Петербурге нетрезвый пациент больницы устроил драку с охраной 
2022-01-17,Путин поручил сократить время оформления медицинской документации 
2022-01-17,В Крыму составили реестр официально работающих отелей и санаториев 
2022-01-17,"ОБСЕ могла бы подталкивать Европу к признанию ""Спутника V"", заявил постпред "
