date,text
2022-01-10,В Киргизии прокомментировали участие иностранцев в протестах в Казахстане 
2022-01-10,Инвестпортал Москвы в 2021 году посетили почти три миллиона раз 
2022-01-10,Число жертв беспорядков в Казахстане среди мирного населения уточняется 
2022-01-10,Щербаков вспомнил момент знакомства с женой Бронзовой 
2022-01-10,Житель Кирова пытался задушить таксиста 
2022-01-10,Путин отметил высокий уровень взаимодействия стран ОДКБ 
2022-01-10,Токаев назвал беспорядки в Казахстане замыслом хаоса с захватом власти 
2022-01-10,В Москве из-за снегопада задержаны или отменены более 60 рейсов 
2022-01-10,Премьер Киргизии предупредил о риске проникновения боевиков в страны ОДКБ 
2022-01-10,Путин заявил о вербовке боевиков для беспорядков в Казахстане через соцсети 
2022-01-10,В Москве выявили 2778 новых случаев заражения коронавирусом 
2022-01-10,За сутки в России от COVID-19 умер 741 человек 
2022-01-10,Путин отметил работу ОДКБ по формированию системы безопасности 
2022-01-10,Токаев ответил на критику в адрес миссии ОДКБ в Казахстане 
2022-01-10,"Почти 1,5 миллиона человек посетили парки Подмосковья с 1 по 9 января "
2022-01-10,"Миротворческий контингент выведут из Казахстана, заявил Путин "
2022-01-10,Путин назвал события в Казахстане результатом вмешательства извне 
2022-01-10,Путин заявил об агрессии международного терроризма в Казахстане 
2022-01-10,Путин отметил важность обучения военных ОДКБ по общим программам 
2022-01-10,Последний богатырь опять лидирует в прокате в России и СНГ 
2022-01-10,"ОДКБ показала свой потенциал, заявил Путин "
2022-01-10,"Силы ОДКБ будут в Казахстане столько, сколько необходимо, заявил Путин "
2022-01-10,Путин назвал беспорядки в Казахстане актом агрессии 
2022-01-10,"Ситуация в Казахстане касается всех, заявил Путин "
2022-01-10,Лукашенко пообещал сохранять верность договоренностям по ОДКБ 
2022-01-10,Лукашенко призвал лидеров ОДКБ провести переговоры о Таджикистане 
2022-01-10,Лукашенко призвал не допустить выставления миротворцев ОДКБ оккупантами 
2022-01-10,Лукашенко заявил об участии профессиональных террористов в Казахстане 
2022-01-10,"События в Казахстане стали звеньями одной цепи, заявил Токаев "
2022-01-10,"События в Казахстане координировались из одного центра, заявил Токаев "
2022-01-10,"Бандиты нападали на морги и забирали тела боевиков, заявил Токаев "
2022-01-10,Генсек ОДКБ вылетит в Казахстан 
2022-01-10,Токаев сравнил устраивавших беспорядки в Алма-Ате с гиенами  
2022-01-10,Токаев анонсировал предложения по новому составу правительства 
2022-01-10,"Казахстан представит доказательства агрессии против страны, заявил Токаев "
2022-01-10,"Боевики прикрывались участниками массовых беспорядков, заявил Токаев "
2022-01-10,Токаев опроверг заявления о применении силы против мирных демонстрантов 
2022-01-10,Токаев предложил повысить оперативность реагирования ОДКБ 
2022-01-10,"Девять областных центров находились в руках террористов, заявил Токаев "
2022-01-10,"Двоим военным боевики отсекли головы, заявил Токаев "
2022-01-10,"Бандиты в Казахстане имели численное преимущество, заявил Токаев "
2022-01-10,"Курорт ""Эльбрус"" работает в штатном режиме после пожара на канатной дороге "
2022-01-10,Токаев поблагодарил Путина и Лукашенко за помощь и боевое братство 
2022-01-10,В Казахстане усилили охрану дипломатических миссий 
2022-01-10,"Врач назвал четыре опасных симптома, требующих обращения за помощью "
2022-01-10,Все организации здравоохранения Казахстана работают в штатном режиме 
2022-01-10,В Казахстане начались досудебные расследования после беспорядков 
2022-01-10,"Более 1,5 тысячи человек нарушили режим ЧП в Казахстане "
2022-01-10,В Новосибирской области нашли брошенного в коробке младенца 
2022-01-10,В центре Алма-Аты начали убирать сгоревшую технику 
2022-01-10,Президент Казахстана провел заседание оперативного штаба 
2022-01-10,"В Алма-Ате задержали более двухсот человек, у них изъяли оружие "
2022-01-10,Слуцкий сравнил заявления Блинкена о Казахстане с риторикой холодной войны 
2022-01-10,Посольство России выразило соболезнования родным погибших в Казахстане 
2022-01-10,В МИД оценили позицию США по переговорам в Женеве 
2022-01-10,В миссии ЕС заявили о готовности помочь Казахстану в урегулировании кризиса 
2022-01-10,Власти Кипра обновили правила въезда в страну для туристов 
2022-01-10,В Японии назвали главное отличие Путина от всех российских политиков 
2022-01-10,В МИД прокомментировали заявление США о неразмещении ракет на Украине 
2022-01-10,Большинство аэропортов Казахстана работают в штатном режиме 
2022-01-10,В МИД призвали США и НАТО проявить гибкость на переговорах по безопасности 
2022-01-10,В поисках Судбищ. Как архивы подтвердили главное открытие года? 
2022-01-10,Военно-транспортные самолеты эвакуировали из Казахстана 1461 россиянина 
2022-01-10,В Госдуме обсудят введение обязательных тестов на наркотики в школах 
2022-01-10,Внеочередной саммит ОДКБ начнется в 10:00 по московскому времени 
2022-01-10,"В Нур-Султан прибыл первый рейс ""Аэрофлота"" "
2022-01-10,"Почему ""Конгресс интеллигенции"" всегда против России "
2022-01-10,"НАТО встает плечом к плечу против ""русской геополитической экспансии"" "
2022-01-10,"Взлет цен, битва за космос и китайцы: что грозит экономике в 2022-м "
2022-01-10,"Вместо Куршевеля. Обзор горнолыжных курортов, куда могут поехать россияне "
2022-01-10,Силы ОДКБ не участвуют в контртеррористической операции в Казахстане 
2022-01-10,Мэр Алма-Аты заявил о постепенной нормализации жизнедеятельности города 
2022-01-10,"Россия хочет проверить способность США принимать решения, заявил Рябков "
2022-01-10,На понедельник в Казахстане запланировали 193 рейса 
2022-01-10,В ДТП в Приамурье погибли три человека 
2022-01-10,Белоруссия выразила надежду на установление спокойствия в Казахстане 
2022-01-10,Сумма ущерба от беспорядков в Казахстане превысила 215 миллионов долларов 
2022-01-10,"Большинство россиян планируют сменить работу в 2022 году, показал опрос "
2022-01-10,"Фильм ""Власть пса"" получил ""Золотой глобус"" "
2022-01-10,В Нур-Султане более 60 человек нарушили режим ЧП 
2022-01-10,"Посол Украины потребовал от Германии отказаться от ""Северного потока — 2"" "
2022-01-10,"Композиция из фильма о Бонде ""Не время умирать"" завоевала ""Золотой глобус"" "
2022-01-10,В Забайкалье ввели QR-коды для посещения торговых центров 
2022-01-10,"В Шымкенте задержали более 2,7 тысячи человек "
2022-01-10,"Госсекретарь Казахстана заявил, что речь идет не о цветной революции "
2022-01-10,"Британцы высмеяли адмирала, испугавшегося российских подлодок "
2022-01-10,"В Казахстане заявили, что помощь ОДКБ позволила защитить целостность страны "
2022-01-10,В Казахстане заявили о гибридной террористической атаке с целью переворота 
2022-01-10,"Обстановка в Алма-Ате стабилизируется, сообщили СМИ "
2022-01-10,"Торгпред заявил, что Россия не готова отменить все пошлины на сою для Китая "
2022-01-10,"Роспатент признал незаконной регистрацию товарного знака ""День тигра"" "
2022-01-10,СМИ: в США призвали Салливана отправить на Украину больше оружия 
2022-01-10,"Эксперт заявил, что Казахстану не следует сейчас проводить новые выборы "
2022-01-10,Антонов связал беспорядки в Казахстане с бегством США из Афганистана 
2022-01-10,"Рябков заявил, что США чувствуют за собой ""глаза и уши"" партнеров-русофобов "
2022-01-10,Автоэксперт научил безопасному перестроению на заснеженной дороге 
2022-01-10,Экс-аналитик ЦРУ назвал причину кризисной ситуации вокруг Украины 
2022-01-10,"Эксперт назвал шоковые сценарии, которые ждут рынки весной "
2022-01-10,"Названа причина пожара в Нью-Йорке, унесшего 19 жизней "
2022-01-10,Антонов ответил на претензии США к отправке сил ОДКБ в Казахстан 
2022-01-10,В Атырауской области Казахстана выросло число пострадавших в беспорядках 
2022-01-10,"В Киеве потеряли надежду на ""возвращение"" Крыма "
2022-01-10,Университет Хопкинса: число случаев COVID-19 в США превысило 60 миллионов 
2022-01-10,"Мэр Нью-Йорка подтвердил, что при пожаре в Бронксе погибли 19 человек "
2022-01-10,В Атырау установили четыре блокпоста на въезде в город 
2022-01-10,"В МИД Казахстана рассказали, когда миротворцы ОДКБ покинут республику "
2022-01-10,МИД Казахстана: среди нападавших есть люди с опытом в горячих точках 
2022-01-10,В госдепе рассказали о предварительных переговорах с Россией в Женеве 
2022-01-09,"Участок Великой Китайской стены обрушился из-за землетрясения, сообщили СМИ "
2022-01-09,На юге Армении произошло землетрясение 
2022-01-09,При пожаре в многоэтажном доме в Нью-Йорке погибли не меньше 19 человек 
2022-01-09,Рябков прокомментировал предстоящие переговоры с США в Женеве 
2022-01-09,"В США назвали бесполезные ""страны-иждивенцы"" "
2022-01-09,Почти 400 нацгвардейцев Казахстана пострадали во время беспорядков 
2022-01-09,"Террористы ""ан-Нусры""* совершили шесть обстрелов в Идлибе "
2022-01-09,В Нью-Йорке при пожаре в жилом доме серьезно пострадал 31 человек 
2022-01-09,Киргизия эвакуировала еще 14 своих граждан из Казахстана 
2022-01-09,В Госдуме прокомментировали предложение повысить НДФЛ до 50 процентов 
2022-01-09,"Благодаря ОДКБ в Казахстане удалось переломить ситуацию, заявил эксперт "
2022-01-09,Столтенберг: возможность политического решения ситуации вокруг Украины есть 
2022-01-09,Токаев посмертно наградил 16 погибших казахстанских сотрудников органов 
2022-01-09,"В Югре нашли место продажи алкоголя, от которого умерли восемь человек "
2022-01-09,"Блинкен заявил, что Россия ""хочет"" восстановить Советский Союз "
2022-01-09,"Украинский кот выжил после получасовой ""стирки"" в машинке "
2022-01-09,На белорусско-польской границе нашли беженца с переломом и обморожением 
2022-01-09,"Шведы объяснили, почему опасно ""загонять в угол"" Россию вступлением в НАТО "
2022-01-09,В Алма-Ате создали фонд поддержки пострадавшего бизнеса 
2022-01-09,Захарова прокомментировала предстоящие переговоры с США в Женеве 
2022-01-09,В Киев вылетел пассажирский самолет из Нур-Султана  
2022-01-09,Вирусолог назвал необычную способность омикрон-штамма 
2022-01-09,"МИД заявил, что 1422 человека вылетели из Алма-Аты в Россию  "
2022-01-09,"В мэрии Алма-Аты заявили, что и.о. мэра пытались убить "
2022-01-09,"США готовы обсудить с Россией учения в Восточной Европе, заявил Блинкен "
2022-01-09,"Россия и США обсудят вопросы по РСМД в Женеве, заявил Блинкен "
2022-01-09,На одном из главных мостов Кишинева рухнули два столба 
2022-01-09,Белорусские миротворцы ОДКБ охраняют аэродром и арсенал в Казахстане 
2022-01-09,Блинкен прокомментировал предстоящие переговоры с Россией 
2022-01-09,Второй самолет ВКС доставил сотню россиян в Москву из Алма-Аты 
2022-01-09,И.о. мэра Алма-Аты попал под обстрел во время беспорядков 
2022-01-09,Боррель пригрозил России последствиями в случае эскалации на Украине 
2022-01-09,Президент Казахстана работает в режиме нон-стоп 
2022-01-09,Более ста украинцев не могут вылететь из Алма-Аты 
2022-01-09,ЕС считает диалог с Россией по безопасности необходимым 
2022-01-09,"Боррель заявил, что любой диалог с Россией требует присутствие Киева "
2022-01-09,"Врачи объяснили, почему омикрон-штамм опасен для детей "
2022-01-09,Президент Киргизии не исключил участия сограждан в акциях в Казахстане 
2022-01-09,Военно-транспортные самолеты Минобороны вывезли из Алма-Аты 500 россиян 
2022-01-09,Военный самолет доставил в Москву сотню россиян из Алма-Аты 
2022-01-09,Украине предрекли год кризисов 
2022-01-09,Минюст ФРГ анонсировал миллионные штрафы мессенджеру Telegram 
2022-01-09,Замглавы минобороны Казахстана поблагодарил силы ОДКБ за помощь стране 
2022-01-09,В ЛНР заявили о новых обстрелах со стороны украинских силовиков 
2022-01-09,В российских регионах подорожало ОСАГО 
2022-01-09,В Казахстане оценили значение работы миротворцев ОДКБ 
2022-01-09,"В Казахстане рассказали, сколько продлится контртеррористическая операция "
2022-01-09,Тиктокера Даню Милохина не пустили на Украину 
2022-01-09,В ОДКБ обсудили развертывание миротворцев в Казахстане 
2022-01-09,Виндзорский замок защитят бесполетной зоной 
2022-01-09,Узбекистан изменил правила въезда в страну 
2022-01-09,"Песков заявил, что сессия ОДКБ пока не планирует подписание документов "
2022-01-09,В Бишкеке прошел митинг против задержания киргизского джазмена в Казахстане 
2022-01-09,"Украинские силовики возобновили обстрелы, заявили в ДНР "
2022-01-09,В Алма-Ате во время беспорядков погибли более ста человек 
2022-01-09,В Казахстане за медпомощью обратились более двух тысяч человек 
2022-01-09,Глава МИД Кипра объявил об отставке 
2022-01-09,Омбудсмен заявила о гибели трех детей во время беспорядков в Казахстане 
2022-01-09,Российская делегация прибыла в Женеву на переговоры с США 
2022-01-09,Более 20 тысяч казахстанцев обратились за психологической помощью 
2022-01-09,"Назван продукт, защищающий от инфекций "
2022-01-09,Из Алма-Аты вылетели первые три самолета с россиянами 
2022-01-09,Путин примет участие в сессии Совета коллективной безопасности ОДКБ 
2022-01-09,"В Киргизии заявили, что задержанный в Казахстане музыкант не террорист "
2022-01-09,Жителям столицы пообещали крупнейшие со времен Битвы за Москву сугробы 
2022-01-09,"Россия едет на встречу с США не с протянутой рукой, заявил Рябков "
2022-01-09,"Пушков обвинил США в желании ""жестко поторговаться"" с Россией "
2022-01-09,В Таразе ликвидировали около десяти преступников 
2022-01-09,Что не так с детскими сказками о богатырях? Неизвестные былины 
2022-01-09,Оперштаб назвал регион с нулевым темпом прироста случаев COVID-19 
2022-01-09,В России за сутки выписали 20 751 переболевшего COVID-19 
2022-01-09,В Москве выявили 3274 новых случая заражения коронавирусом 
2022-01-09,Во время беспорядков в Казахстане погибли двое военных 
2022-01-09,В Казахстане свыше 130 подозреваемых находятся в изоляторах 
2022-01-09,В Кызылорде задержали 27 человек 
2022-01-09,"В центре казахстанского Актау, где недавно проходили митинги, гуляют люди "
2022-01-09,Казахстан возвращается к обычной жизни 
2022-01-09,Российские миротворцы начали тренировки в Казахстане 
2022-01-09,"В Бишкеке заявили, что в Казахстане задержали киргизского музыканта "
2022-01-09,Минобороны Турции заявило о нейтрализации 12 курдских боевиков 
2022-01-09,Владельцы оружия с 2022 года должны будут сообщать о его утере 
2022-01-09,В Доминикане задержали одного из подозреваемых в убийстве главы Гаити 
2022-01-09,Оружие в России в 2022 году объявят источником повышенной опасности 
2022-01-09,"Латвийское телевидение опозорилось, переведя концерт группы Depeche Mode "
2022-01-09,"В Москве за год выполнили более 2,5 миллиона анализов качества воды "
2022-01-09,В Алма-Ате задержали около ста террористов и мародеров за ночь 
2022-01-09,В МИД оценили сигналы Запада перед встречей по безопасности 
2022-01-09,В Югре восемь человек умерли от отравления суррогатным алкоголем 
2022-01-09,Токаев поручил создать комиссию для ликвидации последствий беспорядков 
2022-01-09,Под охрану контингента ОДКБ в Казахстане передали стратегические объекты 
2022-01-09,После беспорядков в Казахстане возбудили 125 дел 
2022-01-09,Полиция Нур-Султана проводит подворовой и поквартирный обход 
2022-01-09,Около 700 жителей Нур-Султана сдали кровь для пострадавших в беспорядках 
2022-01-09,В казахстанском Шымкенте 45 полицейских пострадали во время беспорядков 
2022-01-09,Минздрав Казахстана опроверг информацию о захвате биолаборатории 
