"card-full-news__title","card-full-news__info-item","card-full-news__info-item 2"
"iPhone 12 Pro упал с 26-го этажа и не разбился","11:35, 28 декабря 2022","Из жизни"
"Первый южнокорейский аппарат вышел на орбиту Луны","11:23, 28 декабря 2022","Наука и техника"
"Найдены следы обрушения колец Урана на спутник Миранда","10:44, 28 декабря 2022","Наука и техника"
"Стилист Васильев перечислил тренды в одежде на 2023 год","10:35, 28 декабря 2022","Ценности"
"Слепой репортер набросился на пытавшегося украсть телефон вора","09:22, 28 декабря 2022","Интернет и СМИ"
"Фрегат «Адмирал Горшков» завершил подготовку к боевой службе","09:19, 28 декабря 2022","Наука и техника"
"800-й гол Овечкина назвали лучшим моментом 2022 года в НХЛ","09:19, 28 декабря 2022","Спорт"
"Из «Аватара 2» вырезали десять минут фильма из-за проблем с оружием в США","08:02, 28 декабря 2022","Культура"
"Диетолог назвала допустимую дозу алкоголя на Новый год","05:06, 28 декабря 2022","Забота о себе"
"Открыт новый класс противоречащих законам физики галактик","04:30, 28 декабря 2022","Наука и техника"
"Россиянам рассказали об опасности переноса денег из банка в банк","04:25, 28 декабря 2022","Экономика"
"Женщина примерила откровенный наряд дочери и удивила ее подписчиков","04:00, 28 декабря 2022","Ценности"
"Россиянам рассказали о порядке выхода на пенсию в 2023 году","03:10, 28 декабря 2022","Экономика"
"Диетолог предупредила об опасности холодца для некоторых людей","23:35, 27 декабря 2022","Забота о себе"
"Диетолог назвала опасность злоупотребления кофе","23:12, 27 декабря 2022","Забота о себе"
"Диетолог назвала способы избежать вздутия живота во время праздников","21:04, 27 декабря 2022","Забота о себе"
"Установлен последний период существования моста между Америкой и Азией","21:00, 27 декабря 2022","Наука и техника"
"Бывшая стюардесса рекомендовала путешественникам оставлять обувь в сейфе отеля","20:39, 27 декабря 2022","Путешествия"
"Ким Кардашьян высмеяли в сети за нелепый фотошоп на снимке в бикини","20:09, 27 декабря 2022","Ценности"
"Доказано преимущество женщин в когнитивной эмпатии","20:02, 27 декабря 2022","Наука и техника"
"Роспотребнадзор назвал безопасные составляющие детского сладкого подарка","19:36, 27 декабря 2022","Забота о себе"
"Названа самая популярная страна у российских туристов в 2022 году","19:33, 27 декабря 2022","Путешествия"
"Названы самые красивые горнолыжные курорты России","19:10, 27 декабря 2022","Путешествия"
"Названы самые продаваемые кроссовки в 2022 году","18:42, 27 декабря 2022","Ценности"
"Популярные боксеры поругались из-за отношения к ментальному здоровью","18:33, 27 декабря 2022","Забота о себе"
"Победившая облысение женщина назвала способы избежать выпадения волос","18:08, 27 декабря 2022","Ценности"
"Samsung уступила Apple на важном рынке","18:05, 27 декабря 2022","Наука и техника"
"Блогерша назвала лучший момент для применения сухого шампуня","17:36, 27 декабря 2022","Ценности"
"Россиян предупредили об особой опасности баночных алкогольных напитков","17:16, 27 декабря 2022","Забота о себе"
"Названы самые ожидаемые сериалы 2023 года","17:05, 27 декабря 2022","Культура"
"В Алтайском заповеднике засняли редкого зверя из Красной книги","16:35, 27 декабря 2022","Моя страна"
"Россиянам назвали время наступления пика заболеваемости свиным гриппом","16:32, 27 декабря 2022","Забота о себе"
"Россиянам стали доступны выгодные туры в популярные пляжные страны на Рождество","16:04, 27 декабря 2022","Путешествия"
"Выявлено полезное для климата свойство бурых водорослей","15:43, 27 декабря 2022","Наука и техника"
"Российский врач раскрыла секреты молодости 51-летнего нестареющего Джареда Лето","15:39, 27 декабря 2022","Забота о себе"
"В Нижегородском заповеднике выпустили в дикую природу шесть северных оленей","15:33, 27 декабря 2022","Моя страна"
"Косметолог раскрыла россиянкам способы уменьшить щеки","15:14, 27 декабря 2022","Ценности"
"Перечислены самые ожидаемые смартфоны 2023 года","14:54, 27 декабря 2022","Наука и техника"
"Звезда «Дома дракона» раскрыла секрет своей прически в сериале","14:42, 27 декабря 2022","Ценности"
"Песня All I Want for Christmas Is You стала самой прослушиваемой в Spotify","14:33, 27 декабря 2022","Культура"
"Женатым мужчинам подсказали способ пресечь попытки флирта со стороны коллег","14:03, 27 декабря 2022","Забота о себе"
"Назван самый модный головной убор на зиму","14:00, 27 декабря 2022","Ценности"
"Внешность 74-летней матери звезды Hi-Fi удивила фанатов","13:32, 27 декабря 2022","Ценности"
"Россия и Китай захотели возобновить наземное пассажирское сообщение","13:17, 27 декабря 2022","Путешествия"
"Названы причины провала нового iPhone","13:16, 27 декабря 2022","Наука и техника"
"В Липецке спасли упавшую в уличный туалет собаку","13:15, 27 декабря 2022","Моя страна"
"Тренер поделилась мнением об отказе от диеты и спорта на время праздников","12:18, 27 декабря 2022","Ценности"